{
  "company_name": "McCarty Squared Inc.",
  "slug": "mccarty-squared",
  "tagline": "Dream. Plan. Build.",
  "location": {
    "city": "London",
    "province": "ON",
    "address": "",
    "postal_code": ""
  },
  "principals": [
    {
      "name": "Garnet",
      "role": "Co-Owner / Lead Builder",
      "description": "Job site contact and lead craftsman"
    },
    {
      "name": "Carisa",
      "role": "Co-Owner / Business Manager",
      "description": "General inquiries and project coordination"
    }
  ],
  "phone": "(226) 700-2548",
  "email": "info@mccartysquared.ca",
  "website": "https://mccartysquared.ca",
  "hours": "Mon-Fri 8am-5pm",
  "booking_url": "https://mccartysquared.ca/booking",
  "founded_year": 2021,
  "services": [
    { "name": "Kitchen Renovation", "description": "Custom kitchen design and renovation" },
    { "name": "Bathroom Renovation", "description": "Full bathroom remodels" },
    { "name": "Basement Finishing", "description": "Unfinished to entertainment-ready" },
    { "name": "Custom Cabinetry", "description": "Built-in and custom cabinet work" },
    { "name": "Flooring", "description": "Hardwood, vinyl plank, tile installation" },
    { "name": "Additions", "description": "Home additions and extensions" },
    { "name": "Heritage Restoration", "description": "Restoring character homes" },
    { "name": "Accessibility Modifications", "description": "Aging-in-place and accessibility upgrades" },
    { "name": "Net-Zero Homes", "description": "Energy-efficient building and retrofits" },
    { "name": "Outdoor Living", "description": "Decks, patios, outdoor spaces" },
    { "name": "Commercial Renovation", "description": "Office and retail space renovation" },
    { "name": "Whole Home Renovation", "description": "Complete home transformation" },
    { "name": "Painting & Drywall", "description": "Interior and exterior finishing" }
  ],
  "certifications": [
    "RenoMark",
    "LHBA",
    "NetZero Home",
    "Houzz Pro",
    "London Chamber of Commerce"
  ],
  "testimonials": [
    {
      "author": "Ziad A.",
      "quote": "McCarty Squared did a fantastic job renovating our house. Garnet and Carisa fully understood our vision, ensuring everything — kitchen, bathrooms and bedrooms — was perfect. We won't hesitate to call them for future projects. Highly recommend them!",
      "project_type": "Whole Home Renovation",
      "rating": 5
    },
    {
      "author": "Megan E.",
      "quote": "Garnet and Carisa helped with my apartment overhaul in a 112-year-old house. They combined what I had hoped with new ideas I had never considered and provided exceptional workmanship to complete the project. They made me feel like family and my house is now truly a home.",
      "project_type": "Heritage Apartment Overhaul",
      "rating": 5
    },
    {
      "author": "Jenny K. S.",
      "quote": "Garnet's professionalism, knowledge, and expertise are among the best in London. I've worked with six other contractors in the past nine years, and Garnet was by far my favorite. His precise assessment and detailed education on technical aspects were invaluable.",
      "project_type": "Home Renovation",
      "rating": 5
    }
  ],
  "service_areas": [
    "London", "Argyle", "Arva", "Belmont", "Byron", "Dorchester",
    "Hyde Park", "Ingersoll", "Komoka", "Masonville", "Mt Brydges",
    "North London", "Oakridge", "Old North", "OEV", "St Thomas",
    "Strathroy", "Tillsonburg", "Woodfield", "Wortley"
  ],
  "socials": {
    "facebook": "https://www.facebook.com/mccartysquared",
    "instagram": "https://www.instagram.com/mccartysquared",
    "google_business": "https://g.co/kgs/mccartysquared",
    "houzz": "https://www.houzz.com/pro/mccartysquared"
  },
  "brand_colors": {
    "primary_hex": "#1565C0",
    "secondary_hex": "#FFFFFF",
    "primary_oklch": "0.45 0.18 250"
  },
  "hero_headline": "Dream. Plan. Build.",
  "hero_description": "With a focus on quality craftsmanship and integrity, McCarty Squared provides superior construction and renovation services in London, Ontario and surrounding areas, dedicated to bringing your dream projects to fruition.",
  "about_copy": [
    "Founded in 2021 by Garnet and Carisa, McCarty Squared Inc. has quickly become one of London's most trusted renovation contractors. Our past projects include both commercial and residential spaces across 13 service categories.",
    "From accessibility modifications and net-zero homes to heritage restoration and custom cabinetry — we focus on quality craftsmanship as well as modern building techniques. A clean, courteous, efficient worksite is a must, and taking care of our clients is what we do best.",
    "We offer an end-to-end client experience that includes seamless communication, budgeting, on-site organization, and solid, quality handiwork every time. From the design phase to the last touch-ups, we'll be there working hard to finish on time and on budget."
  ],
  "mission_statement": "To transform houses into dream homes through exceptional craftsmanship, innovative technology, and an unwavering commitment to customer satisfaction.",
  "process_steps": [
    { "title": "Design Consultation", "description": "Collaborate with experts to refine your vision" },
    { "title": "Planning & Approval", "description": "Finalize detailed plans and obtain necessary permits" },
    { "title": "Construction Phase", "description": "Skilled crew executes with precision and quality materials" },
    { "title": "Final Inspection", "description": "Review completed project for quality assurance" }
  ],
  "values": [
    { "title": "Customer First", "description": "Your satisfaction drives everything we do." },
    { "title": "Quality Craftsmanship", "description": "RenoMark certified. Every detail matters." },
    { "title": "Integrity", "description": "Honest pricing, realistic timelines, transparent communication." }
  ]
}
